{
  "candidate_counts": {
    "by_evidence": {
      "distance": 23,
      "exact_name": 384,
      "name_similarity": 23
    },
    "by_negative_evidence": {
      "collapsed_coordinate": 4,
      "different_cnpj": 4
    },
    "by_relation": {
      "distinct_entities": 4,
      "possible_same_entity": 379,
      "unresolved": 11
    },
    "by_review_status": {
      "pending": 390,
      "rejected": 4
    },
    "total": 394
  },
  "canonical_entities_created": 0,
  "curated_exclusions": {
    "absent": 143,
    "ambiguous": 0,
    "bridge_original_ambiguous": 0,
    "bridge_original_missing": 0,
    "matched": 3,
    "rows": 146
  },
  "equations": {
    "candidate_relations": "394 = 394",
    "curated_ledger": "3 + 143 + 0 = 146",
    "occurrences_preserved": "8815 = 8815"
  },
  "input": {
    "bytes": 11599613,
    "counts_by_source": {
      "bahia_google": 550,
      "ceao": 1155,
      "cnpj": 2673,
      "mapeando_axe": 3923,
      "osm": 20,
      "sefaz": 234,
      "terreiros_brasil": 260
    },
    "occurrences": 8815,
    "sha256": "81ec25970498272c4e0fbd7305b721f57a8da05ef4ed521accb5c323c074b5d2"
  },
  "metric_change": {
    "candidate_pairs_before_d2": 567,
    "candidate_pairs_without_siafi_bridge": 352,
    "description": "Os 567 pares anteriores usavam a semântica pré-D2. O resultado intermediário de 352 pares já harmonizava IBGE e texto, mas interpretava o código municipal de quatro dígitos do CNPJ como IBGE e deixava essa geografia desconhecida. A ponte oficial SIAFI→IBGE restaura as comparações municipais válidas; os demais controles D2 continuam ativos.",
    "historical_geographic_homonym_pairs": 1193,
    "historical_incomparable_ibge_text_pairs": 39
  },
  "metrics": {
    "candidate_component_ref_occurrences": 788,
    "candidate_components": 394,
    "collapsed_coordinate_groups": 104,
    "exact_name_cross_source_groups": 113,
    "exact_name_cross_source_pairs": 245,
    "exact_name_groups_overall": 406,
    "exact_name_groups_same_municipality": 164,
    "exact_name_pairs_same_municipality": 373,
    "geographic_homonym_pairs": 952,
    "name_pair_comparisons": 543,
    "occurrences_preserved": 8815,
    "oversized_name_groups": 0,
    "oversized_name_theoretical_pairs": 0,
    "oversized_spatial_bucket_details": [
      {
        "bucket_id": "3550308|SP|-9510|-5235",
        "estrategia": "skip",
        "pares_elegiveis_encontrados_bruteforce": 0,
        "pares_elegiveis_estimados": 23653,
        "razao": "collapsed_coordinate_group",
        "registro_count": 218
      }
    ],
    "oversized_spatial_buckets": 1,
    "pair_comparison_budget": 250000,
    "placeholder_name_records": 100,
    "proximity_name_compatible_pairs": 23,
    "records_with_name": 8814,
    "spatial_pair_comparisons": 19512,
    "unique_occurrence_refs_in_components": 434
  },
  "outputs": {
    "candidates": {
      "bytes": 280478,
      "lines": 394,
      "sha256": "609ee1252891c47722b3d4c34a4023df7f9623b6a27f35b26abfa4f3b8157417"
    },
    "occurrence_status": {
      "bytes": 1476275,
      "lines": 8815,
      "sha256": "849e1a369b395b89b6694e66df6829f75ad88b26b7402f46bffc7a1428079147"
    }
  },
  "privacy": {
    "occurrence_ref_protocol": "sha256(occurrence-ref-v1\\0source_record_key)",
    "source_record_key_published": false
  },
  "protocol_version": "dedup-candidate-v3"
}
